{
  "schema_version": "controlled-contract-obligation-coverage.v1",
  "wk_id": "WK-2518",
  "focus": null,
  "obligations": [
    {
      "obligation_id": "OBLIGATION-001",
      "source_locator": "/acceptance/criteria/0",
      "source_locator_digest": "sha256:78a39cfcbeda3c55d4effa0bd6ce20a2c190b0180cee2b7821f4ec738bbfd68a",
      "statement": "Admission target: production workspace_agent_dispatch registration and admitAgentDispatchRequest accept the exact legitimate request at admission only; the real env.PATH dictionary value ../opaque-control.txt is schema-admitted, preserved and opaque to protected authority coordinates. Demonstrate this; do not add a field, change parser behavior, invoke its lazy continuation, or substitute a mock parser/resolver. If the control is not actually accepted, return the precise blocker. Proof limitation: this test-validity selector records the intended validity mechanism for the retained runtime test; it does not establish this behavioral requirement or consume these generic criterion claims. Full selected-pack guarantee coverage remains outside_pack and unresolved. The narrower OBLIGATION-015 through OBLIGATION-018 mappings do not discharge this full obligation.",
      "controlled_contract_node_ids": [
        "claim-5645935490402421f28745ecb2ad192f056d108f",
        "claim-7c62d9d4c16c3235472cd520fb2a11636fdacdf0"
      ],
      "mechanism": {
        "owner": "agent-chassis/agent-chassis:WK-2518 implementation worker",
        "kind": "test",
        "selector": "tests/integration/dispatch-ingress-caller-authority-capture.test.mjs"
      },
      "proof": {
        "kind": "pack_mapping",
        "pack_id": "proof.verification.test-validity",
        "requested_intent": "controlled-proof-intent.test-verification-validity",
        "profile_id": "proof.verification.test-validity",
        "profile_version": "2.0.0",
        "selector": {
          "kind": "claim",
          "component_id": "suite-covers-component"
        },
        "evaluation_stage": "pre_dispatch"
      }
    },
    {
      "obligation_id": "OBLIGATION-002",
      "source_locator": "/acceptance/criteria/1",
      "source_locator_digest": "sha256:9a841038bc30ebdb8c65475936b8051e65e594e719cba8e1b3d7ffe3a2ef3083",
      "statement": "Refusal cut: the corresponding actual request plus registered authority:true returns caller_supplied_cce_policy_authority with the caller-supplied-identity blocker and authority in refused_fields before resolveWorkspaceRepo or any protected downstream continuation. Cover every incumbent forbidden-field family and precedence as regressions without extending this claim to WK-2510 policy selection, no-gate settlement or automatic review. Across-family precedence follows the admission owner loop; registered authority lists collect all present fields in the first matching family, while nested identity is first-carrier-wins. Identity regressions assert the owning refusal code/blocker and identityRefusal.detail.carrier, without pinning incidental envelope-key refused_fields/count or repairing that production projection. Reviewer SHA-subject correction is a separate subject/role branch. Proof limitation: this test-validity selector records the intended validity mechanism for the retained runtime test; it does not establish this behavioral requirement or consume these generic criterion claims. Full selected-pack guarantee coverage remains outside_pack and unresolved. The narrower OBLIGATION-015 through OBLIGATION-018 mappings do not discharge this full obligation.",
      "controlled_contract_node_ids": [
        "claim-521edcb0d6cad753258f2bbdc500901333792ec9",
        "claim-5a07dc1e2bc66b262cf7698d37c000ba1578f260"
      ],
      "mechanism": {
        "owner": "agent-chassis/agent-chassis:WK-2518 implementation worker",
        "kind": "test",
        "selector": "tests/integration/dispatch-ingress-caller-authority-capture.test.mjs"
      },
      "proof": {
        "kind": "pack_mapping",
        "pack_id": "proof.verification.test-validity",
        "requested_intent": "controlled-proof-intent.test-verification-validity",
        "profile_id": "proof.verification.test-validity",
        "profile_version": "2.0.0",
        "selector": {
          "kind": "claim",
          "component_id": "suite-covers-component"
        },
        "evaluation_stage": "pre_dispatch"
      }
    },
    {
      "obligation_id": "OBLIGATION-003",
      "source_locator": "/acceptance/criteria/2",
      "source_locator_digest": "sha256:62f444575a76783eb2257f82629ba8e16eead999a6267350dcb4c815bc3a97a9",
      "statement": "Complete observation: derive the exact loaded admission dependency/callsite census and all nine source channels (resolver, loader, filesystem, environment, module, catalog, subprocess, return, success), with actual source-specific start/end state/version and monotone refusal cut. Require real occurrence-injection sensitivity at resolver, protected successful-return and success/continuation hooks. The current closure has no call-time filesystem/subprocess/module/loader port; catalog uses loaded metadata and environment access is in the imported identity owner. For those channels require exact-generation census-completeness falsifiers (removed/extra reachable callsite, missing/duplicate/extra source, missing endpoint, stale closure). A newly reachable protected operation requires its actual hook or an explicit missing-hook blocker. Never infer nine complete empty channels from one spy or relabel census inspection as runtime observation. Dropped/late/misordered events and stale module/schema generations must not produce success. Refusal output is not protected successful dispatch return. Proof limitation: this test-validity selector records the intended validity mechanism for the retained runtime test; it does not establish this behavioral requirement or consume these generic criterion claims. Full selected-pack guarantee coverage remains outside_pack and unresolved. The narrower OBLIGATION-015 through OBLIGATION-018 mappings do not discharge this full obligation.",
      "controlled_contract_node_ids": [
        "claim-20e68e8aa5f9150e48721ec99a80ca383365954a",
        "claim-a27848c794c4007f8fd768547d433bb82a99c763"
      ],
      "mechanism": {
        "owner": "agent-chassis/agent-chassis:WK-2518 implementation worker",
        "kind": "test",
        "selector": "tests/integration/dispatch-ingress-caller-authority-capture.test.mjs"
      },
      "proof": {
        "kind": "pack_mapping",
        "pack_id": "proof.verification.test-validity",
        "requested_intent": "controlled-proof-intent.test-verification-validity",
        "profile_id": "proof.verification.test-validity",
        "profile_version": "2.0.0",
        "selector": {
          "kind": "claim",
          "component_id": "suite-covers-component"
        },
        "evaluation_stage": "pre_dispatch"
      }
    },
    {
      "obligation_id": "OBLIGATION-004",
      "source_locator": "/acceptance/criteria/3",
      "source_locator_digest": "sha256:52feffe0544e0c426aa72a08710bc7fa2184cf200591d3ff65568fb6cccb46d1",
      "statement": "Production provenance: only live host-private acquisition objects yield exact request/outcome bytes and actual signed source assignment, target, source, attempt and authentication witnesses. Use randomly generated per-acquisition/source Ed25519 keys and successful signature verification over actual retained bytes; reject forged/mismatched keys, altered evidence, fixture-only synthetic witnesses and foreign source/attempt. No private keys persisted/exposed; no CCE, admission, launcher identity or general trust authority conferred. Proof limitation: this test-validity selector records the intended validity mechanism for the retained runtime test; it does not establish this behavioral requirement or consume these generic criterion claims. Full selected-pack guarantee coverage remains outside_pack and unresolved. The narrower OBLIGATION-015 through OBLIGATION-018 mappings do not discharge this full obligation.",
      "controlled_contract_node_ids": [
        "claim-d6636eb5982798f80320b6d6083e0af7314eb93d",
        "claim-0f542f718035b2052c9708e0e46b769a5205d49b"
      ],
      "mechanism": {
        "owner": "agent-chassis/agent-chassis:WK-2518 implementation worker",
        "kind": "test",
        "selector": "tests/integration/dispatch-ingress-caller-authority-capture.test.mjs"
      },
      "proof": {
        "kind": "pack_mapping",
        "pack_id": "proof.verification.test-validity",
        "requested_intent": "controlled-proof-intent.test-verification-validity",
        "profile_id": "proof.verification.test-validity",
        "profile_version": "2.0.0",
        "selector": {
          "kind": "claim",
          "component_id": "suite-covers-component"
        },
        "evaluation_stage": "pre_dispatch"
      }
    },
    {
      "obligation_id": "OBLIGATION-005",
      "source_locator": "/acceptance/criteria/4",
      "source_locator_digest": "sha256:bcbabc23e132e8edcb75d67eb70da2d7f1928c744b02747e14f466f76e245b59",